{
  "schemaVersion": 1,
  "id": "bowers-wilkins-a7",
  "displayName": "Bowers & Wilkins A7",
  "manufacturer": "Bowers & Wilkins",
  "model": "A7",
  "firstRelease": 2012,
  "lastFirmware": null,
  "match": {
    "bonjourServiceType": "_raop._tcp",
    "modelHints": ["B&W", "BW-A7", "A7"],
    "macOUI": []
  },
  "roles": {
    "sink": {
      "protocol": "airplay1",
      "codec": {
        "format": "alac",
        "sampleRate": 44100,
        "bitDepth": 16,
        "channels": 2,
        "compressed": true
      },
      "encryption": {
        "et": 0,
        "fallback": "et=1"
      },
      "audioLatencyMs": 93,
      "buffer": "RTP timestamp-based, 4096 samples (~93ms). Identical wire behavior to A5.",
      "quirks": [
        "Inherits all B&W A5 firmware quirks — same AirPort-Express-derived firmware family.",
        "Slower cold-start handshake than A5 under TCP contention: up to 5 sec RTSP RECORD response when multiple receivers compete for handshake bandwidth. Use handshake-barrier mechanism on the sender to ensure cross-AP1 first-audio remains within 1ms despite per-sink handshake variance.",
        "If chirp-based calibration runs against this device while it's in a side room or at low volume, the mic SNR drops below threshold and the measurement becomes unreliable. Calibration code boosts target speaker to 85% during the measurement window and restores afterward."
      ],
      "volumeScale": {
        "type": "dB",
        "min": -30.0,
        "max": 0.0,
        "muted": -144.0
      },
      "knownFirmware": []
    },
    "control": null
  },
  "verifiedBy": ["David Puerto"],
  "verifiedDate": "2026-05-14",
  "contributedDate": "2026-05-18",
  "notes": "Validated alongside the A5 — same protocol family, same wire format. The handshake-variance behavior under multi-receiver TCP contention motivated the M6 handshake barrier."
}
